query,category,title,link,snippet,date,sentiment,sentiment_category
Wicked movie reviews,General Reviews,'Wicked' Review: Cynthia Erivo and Ariana Grande in Oz - The New ...,https://www.nytimes.com/2024/11/21/movies/wicked-review.html,... rated pg mild magical mayhem. running time: 2 hours 40 minutes. theaters. wicked. find tickets.,2024-11-27,0.41666666666666663,Positive
Wicked movie reviews,General Reviews,"Review: For a Movie About Defying Gravity, Wicked Is Leaden | TIME",https://time.com/7177832/wicked-movie-review/,"... movie whose chief anthem advertisement joys defying gravity, wicked surprisingly leaden, promise come.",2024-11-20,-0.19999999999999998,Negative
Wicked movie reviews,General Reviews,'Wicked' - Review Thread : r/movies,https://www.reddit.com/r/movies/comments/1gv6e9j/wicked_review_thread/,... wicked well-oiled machine hands jon m. chu. film adaptation epitomizes modern movie musicals be.,2024-11-19,0.2,Positive
Wicked movie reviews,General Reviews,An Honest Review of the 'Wicked' Movie,https://k923.fm/wicked-review/,... good: soaring high like elphaba · music choreography: bringing broadway's magic big screen · not-so-good: wicked's weak ...,2024-11-22,0.19699999999999998,Positive
Wicked movie reviews,General Reviews,Review: 'Wicked' Is As Enchanting As It Is Exhausting,https://www.vulture.com/article/review-wicked-is-as-enchanting-as-it-is-exhausting.html,"... wicked movie's images big, sure, they're also often shallow; draw attention image, ...",2024-11-19,0.05555555555555556,Positive
Wicked movie reviews,General Reviews,‎'Wicked' review by davidehrlich • Letterboxd,https://letterboxd.com/davidehrlich/film/wicked-2024/1/,"... lights came screening “wicked” last week, first thought “i can't wait egregiously rip movie ...",2024-11-22,0.125,Positive
Wicked movie reviews,General Reviews,'Wicked' Reviewed By 9 and 7 Year Old Superfans of the Show,https://screencrush.com/kids-review-wicked-movie/,"... ... wicked movie horse different color (green, obviously). first ... categories: longform, movie news, movie reviews ...",2024-11-22,0.016666666666666663,Positive
Wicked movie reviews,General Reviews,Two Reviews of 'Wicked',https://100catholicmovies.substack.com/p/wicked-review,"... far movie-musicals go, thought wicked fun, faithful, surprisingly un-woke adaptation quickly become, ...",2024-11-25,0.35833333333333334,Positive
Wicked movie reviews,General Reviews,Wicked Review: Cynthia Erivo & Ariana Grande Defy Gravity In Jaw ...,https://screenrant.com/wicked-movie-review/,"... went movie blind could loved it. standout point make is, ""this movie pg?"" opening moments, ...",2024-11-19,0.09999999999999998,Positive
Wicked movie reviews,General Reviews,Wicked Movie Review from a Former Musical Theatre Kid,https://thekit.ca/culture/wicked-movie-review-ariana-grande/,"... movie, first two parts, fills musical's plot holes. film elevates world oz dazzling aesthetic heights. ...",2024-11-25,0.3333333333333333,Positive
Wicked movie reviews,General Reviews,Wicked Movie Review for Parents - Music City Moms,https://musiccitymoms.net/arts-a-entertainment/wicked-movie-review-for-parents/,"... things consider children wicked movie review parents. wicked – part one rated pg thematic material, brief suggestive content, ...",2024-11-19,0.0,Neutral
Wicked movie reviews,General Reviews,"In 'Wicked', Bad Has Never Felt So Good | Film Review",https://www.thehollywoodoutsider.com/wicked-2024-film-review/,"... comedy, drama, frustration, flirtation, condemnation, covers all. wide-ranging performance recreating millions ...",2024-11-21,0.0,Neutral
Wicked movie reviews,General Reviews,Review: The magic of Wicked and the curse of corporate greed | The ...,https://thespinoff.co.nz/pop-culture/21-11-2024/review-the-magic-of-wicked-and-the-curse-of-corporate-greed,"... new movie musical undoubtedly fun watch, also proof bigger always better, writes stewart sowman-lund.",2024-11-21,0.18727272727272726,Positive
Wicked movie reviews,General Reviews,NOC Review: 'Wicked' is the Movie We Need In These Wicked ...,https://thenerdsofcolor.org/2024/11/22/noc-review-wicked-is-the-movie-we-need-in-these-wicked-times/,"... wicked hands one favorite films year. tremendously fun, entertaining, emotional, visually impressive ...",2024-11-22,0.45999999999999996,Positive
Wicked movie reviews,General Reviews,Movie Review: Wicked – AFPL Journal,https://afpljournal.com/2024/11/25/movie-review-wicked/,"... jon m. chu's adaptation wicked magical cinematic experience masterfully utilizes budget. story, centered ...",2024-11-25,0.5,Positive
Wicked movie reviews,General Reviews,Spoilers - Wicked Thoughts and Reviews | EN World D&D ...,https://www.enworld.org/threads/wicked-thoughts-and-reviews.708133/,"... bad. pacing - oh, man. heck happened here? know, movie literally longer entire ...",2024-11-25,-0.3499999999999999,Negative
Wicked movie reviews,General Reviews,Wicked Review: Defies Gravity and Expectations,https://www.ign.com/articles/wicked-review-ariana-grande-cynthia-erivo-jon-m-chu,... wicked well-oiled machine hands jon m. chu. film adaptation epitomizes modern movie musicals be.,2024-11-20,0.2,Positive
Wicked movie reviews,General Reviews,WICKED movie musical review | R.L. Terry ReelView,https://rlterryreelview.com/2024/11/19/wicked-movie-musical-review/,"... follows elphaba (cynthia erivo), shiz university inevitable journey becoming wicked witch west.",2024-11-19,0.225,Positive
Wicked movie reviews,General Reviews,Why 'Wicked' the movie is better than the Broadway musical - DC ...,https://dctheaterarts.org/2024/11/25/why-wicked-the-movie-is-better-than-the-broadway-musical/,"... chu's wicked deeply compelling story also brings message could exactly kind good world needs. laugh, ...",2024-11-25,0.475,Positive
Wicked movie reviews,General Reviews,Lequita Brooks: Wicked Movie Review Through The Lens of a Black ...,https://jacksonvillefreepress.com/lequita-brooks-wicked-movie-review-through-the-lens-of-a-black-woman/,"... lequita brooks: wicked movie review lens black woman ... lequita brooks, lcsw, msw | you, boo! one going save you!",2024-11-29,-0.26041666666666663,Negative
Wicked movie reviews,General Reviews,Mourning the Wicked: Hating a Movie in a Time of Loathing,https://www.indiewire.com/features/commentary/hating-wicked-movie-1235068918/,... mourning 'wicked': means 'hate' movie time loathing — review. indiewire's chief critic unexpectedly detested jon m.,2024-11-22,-0.35000000000000003,Negative
Wicked movie reviews,General Reviews,Joyce Kulhawik - WICKED is wicked good. JoycesChoices Reviews ...,https://m.facebook.com/joyce.kulhawik/photos/wicked-is-wicked-good-joyceschoices-reviews-httpsjoyceschoicescommovie-wicked/948193967127570/,"... ... 󰤥 13. 󰤦 2. 󰤧. amy j. putnam. glad loved movie! did, too. one nitpick review. say: 'the role elphaba's ...",2024-11-25,0.6875,Positive
Wicked movie reviews,General Reviews,"My Spoiler-Free 'Wicked' Review, Featuring Ariana Grande's ...",https://www.purewow.com/entertainment/wicked-review,... ... review photo wicked movie cast. gareth cattermole/staff/getty images. let start saying whole cast phenomenal. wicked ...,2024-11-19,0.35,Positive
Wicked movie reviews,General Reviews,Movie Review: Wicked Part I - Fangirl Freakout,https://fangirlfreakout.com/2024/11/21/movie-review-wicked-part-i/,... wicked: part cinematic event year top-tier musical adaptation. grande erivo blew away acting vocal ...,2024-11-21,0.0,Neutral
Wicked movie reviews,General Reviews,Wicked Review: Gravity is No Match for Erivo & Grande's Soaring ...,https://popculturereviews.com/2024/11/19/wicked-review/,"... wicked would become musical movie, starring thee incredible cynthia erivo elphaba pop singer superstar ariana grande glinda.",2024-11-19,0.45,Positive
Wicked movie reviews,General Reviews,'Wicked' Review: Long-Awaited Adaptation Defies Expectations,https://rendyreviews.com/movie-reviews/wicked-review,... rating: 3.5/5 ... ✓ unlimited access entire rendy reviews library. ✓ every movie review (2015 - today). ✓ access features ...,2024-11-22,0.0,Neutral
Wicked movie reviews,General Reviews,Wicked (Wicked: Part 1) – Movie Review | TL;DR Movie Reviews ...,https://tldrmoviereviews.com/2024/11/20/wicked-wicked-part-1-movie-review/,"... one faithful musical adaptations ever seen, brings musical's strengths weaknesses.",2024-11-20,0.0,Neutral
Wicked movie reviews,General Reviews,Movie Review: Wicked,https://www.baltimoremagazine.com/section/artsentertainment/movie-review-wicked/,"... still there's lot recommend here, film filled wit cleverness verve. erivo, expected, makes heartbreakingly ...",2024-11-23,0.15000000000000002,Positive
Wicked movie reviews,General Reviews,"60 Second Movie Review: Wicked, Part 1 - Out & About Magazine",https://outandaboutnow.com/60-second-movie-review-wicked-part-1/,"... entertainmentmovie reviews. 60 second movie review: wicked, part 1. o&a movie columnist mark fields' quick take latest releases.",2024-11-22,0.27777777777777773,Positive
Wicked movie reviews,General Reviews,WICKED Finally Makes It To The Big Screen — Review,https://www.theatrely.com/post/wicked-finally-makes-it-to-the-big-screen-review,"... theatrely's film review wicked: part one, wicked movie directed jon m. chu starring ariana grande cynthia erivo.",2024-11-19,0.0,Neutral
Wicked movie reviews,General Reviews,It's not easy being green – Film Review: Wicked Part One – The ...,https://thequeerreview.com/2024/11/19/film-review-wicked-part-one/,"... fair say movie version wicked long time coming, mean delays due cats, covid, ...",2024-11-19,0.05312499999999998,Positive
Wicked movie reviews,General Reviews,Wicked Movie Review: Everything we Hoped For and More | Rewrite ...,https://www.rewritethisstory.com/2024/11/wicked-movie-review-everything-we-hoped.html,... wicked: movie exceeds every expectation delivers spectacle worth every moment wait.,2024-11-20,0.3,Positive
Wicked movie reviews,General Reviews,Wicked review: Beloved Broadway musical hits the big screen,https://www.bostonglobe.com/2024/11/19/arts/wicked-movie-ariana-grande-cynthia-erivo/,"... stephen schwartz's songs amateurs. ""wicked"" movie best cast people sing them.",2024-11-19,1.0,Positive
Wicked movie reviews,General Reviews,"Here's our movie review for ""Wicked."" - The New York Times ...",https://www.facebook.com/nytimes/posts/heres-our-movie-review-for-wicked/958524722796658/,"... here's movie review ""wicked."" ... cynthia erivo strongest draw splashy, o... ... i'm excited hear review ...",2024-11-22,0.375,Positive
Wicked movie reviews,General Reviews,“Wicked” movie review – Bobcat Multimedia,https://bobcatmultimedia.com/6458/thecolonnade/wicked-movie-review/,... “wicked” dazzling prequel “the wizard oz” dorothy makes appearance oz. follows story two witches.,2024-11-27,0.75,Positive
Wicked movie reviews,General Reviews,Review: “Wicked” – Katie at the Movies,https://katieatthemovies.com/2024/11/25/review-wicked/,... jon m. chu's 2021 film adaptation broadway musical heights made suspect particularly skilled director ...,2024-11-25,0.25,Positive
Wicked movie reviews,General Reviews,Wicked: Part I - Movie Review,https://dcfilmdom.com/2024/11/wicked-part-i-movie-review/,... breathtaking adaptation makes eyes ears dance stirring heart soul take beginnings ...,2024-11-19,1.0,Positive
Wicked movie reviews,General Reviews,"'Wicked' Part 1 movie review: Ariana Grande, Cynthia Erivo wow",https://www.azcentral.com/story/entertainment/movies/billgoodykoontz/2024/11/19/wicked-review/76277613007/,"... film, like musical, origin story glinda, good witch “the wizard oz,” elphaba, wicked witch west.",2024-11-19,0.35,Positive
Wicked movie reviews,General Reviews,'Wicked' Is Finally Here—These Are My Thoughts | The Everygirl,https://theeverygirl.com/wicked-movie-review/,"... wicked illustrates looks like brave right thing trust authority cracks. get wrong, wicked still ...",2024-11-22,0.1952380952380953,Positive
Wicked 2024 reviews,General Reviews,'Wicked' Review: Cynthia Erivo and Ariana Grande in Oz - The New ...,https://www.nytimes.com/2024/11/21/movies/wicked-review.html,... rated pg mild magical mayhem. running time: 2 hours 40 minutes. theaters. wicked. find tickets.,2024-11-27,0.41666666666666663,Positive
Wicked 2024 reviews,General Reviews,"Review: For a Movie About Defying Gravity, Wicked Is Leaden | TIME",https://time.com/7177832/wicked-movie-review/,"... john m. chu's adaptation stage musical, starring cynthia erivo ariana grande, might make feel trapped someone else's ...",2024-11-20,-0.1,Negative
Wicked 2024 reviews,General Reviews,"In 'Wicked', Bad Has Never Felt So Good | Film Review",https://www.thehollywoodoutsider.com/wicked-2024-film-review/,"... wicked (2024) | film review ... full disclosure: never seen broadway stage musical wicked. also, never heard single note ...",2024-11-21,0.09285714285714286,Positive
Wicked 2024 reviews,General Reviews,An Honest Review of the 'Wicked' Movie,https://k923.fm/wicked-review/,"... 'wicked: part one' released theaters nationwide friday, november 22. movie currently 89% rating rotten tomatoes 98 ...",2024-11-22,0.0,Neutral
Wicked 2024 reviews,General Reviews,'Wicked' - Review Thread : r/movies,https://www.reddit.com/r/movies/comments/1gv6e9j/wicked_review_thread/,"... 1.8k votes, 1.8k comments. 'wicked' - review thread rotten tomatoes : 91% (117 reviews) - 8.1/10 average rating - certified fresh critics ...",2024-11-19,0.075,Positive
Wicked 2024 reviews,General Reviews,Wicked Review: Cynthia Erivo & Ariana Grande Defy Gravity In Jaw ...,https://screenrant.com/wicked-movie-review/,"... 160 minutes long rated pg scary action, thematic material, brief suggestive material. wicked - poster.",2024-11-19,-0.09000000000000001,Negative
Wicked 2024 reviews,General Reviews,Wicked Review: Defies Gravity and Expectations,https://www.ign.com/articles/wicked-review-ariana-grande-cynthia-erivo-jon-m-chu,"... beyond relatively minor flaws, wicked truly faithful adaptation beloved musical, film couple surprises ...",2024-11-20,0.21666666666666665,Positive
Wicked 2024 reviews,General Reviews,Review: The magic of Wicked and the curse of corporate greed | The ...,https://thespinoff.co.nz/pop-culture/21-11-2024/review-the-magic-of-wicked-and-the-curse-of-corporate-greed,"... ... 2024 oscar winner jonathan glazer. bugger team cannes (photo: supplied). “australian” dog year, hercules went ...",2024-11-21,0.0,Neutral
Wicked 2024 reviews,General Reviews,'Wicked' (2024) Review: A Masterclass In Bringing Stage To Screen ...,https://nerdinitiative.com/2024/11/24/wicked-2024-review-a-masterclass-in-bringing-stage-to-screen/,"... production design costume design shine bring oz, along surrounding communities life. location ...",2024-11-24,0.0,Neutral
Wicked 2024 reviews,General Reviews,Review: Wicked (2024),https://engage.colum.edu/ITL/blog/review--wicked-(2024)/23375/,... erivo's hard-hitting strong voice gave full-body chills time opened mouth. voices performances blend every ...,2024-11-19,0.43333333333333335,Positive
Wicked 2024 reviews,General Reviews,"“Wicked” Film Review: It's “Marvelacal” | by Mark Vena | Nov, 2024 ...",https://markvena.medium.com/wicked-film-review-its-marvelacal-3af15a6b79e2,"... wicked part one triumphant return golden age classic. stunning set pieces, intelligent writing, charming characters",2024-11-23,0.49333333333333335,Positive
Wicked 2024 reviews,General Reviews,Wicked review: This 'drawn-out' and 'self-important' film proves the ...,https://www.bbc.com/culture/article/20241119-wicked-review,... wicked drawn-out bland comparison. might lighter feet editors cut subplot magical talking animals.,2024-11-19,0.16666666666666669,Positive
Wicked 2024 reviews,General Reviews,Review: Wicked (2024),https://engage.colum.edu/ITL/blog/review--wicked-(2024)/23375/,... erivo's hard-hitting strong voice gave full-body chills time opened mouth. voices performances blend every ...,2024-11-19,0.43333333333333335,Positive
Wicked 2024 reviews,General Reviews,"“Wicked” Film Review: It's “Marvelacal” | by Mark Vena | Nov, 2024 ...",https://markvena.medium.com/wicked-film-review-its-marvelacal-3af15a6b79e2,"... wicked part one triumphant return golden age classic. stunning set pieces, intelligent writing, charming characters",2024-11-23,0.49333333333333335,Positive
Wicked 2024 reviews,General Reviews,Wicked review: This 'drawn-out' and 'self-important' film proves the ...,https://www.bbc.com/culture/article/20241119-wicked-review,... wicked drawn-out bland comparison. might lighter feet editors cut subplot magical talking animals.,2024-11-19,0.16666666666666669,Positive
Wicked 2024 reviews,General Reviews,Review: Wicked (2024) — 3 Brothers Film,https://3brothersfilm.com/blog/2024/12/20/review-wicked-2024,"... review: wicked (2024) ... wicked 102 minutes (which happens running time wizard oz), would acceptable ...",2024-12-20,0.0,Neutral
Wicked 2024 reviews,General Reviews,Spoilers - Wicked Thoughts and Reviews | EN World D&D ...,https://www.enworld.org/threads/wicked-thoughts-and-reviews.708133/,"... bad. pacing - oh, man. heck happened here? know, movie literally longer entire musical, even ...",2024-11-25,-0.23333333333333328,Negative
Wicked 2024 reviews,General Reviews,Wicked movie review & film summary (2024) | Roger Ebert,https://www.rogerebert.com/reviews/wicked-film-review,"... prequel wizard oz thrilling, whether we're munchkinland, emerald city campus shiz university.",2024-11-22,0.25,Positive
Wicked 2024 reviews,General Reviews,'Wicked' Review: Rival Divas Carry the Year's Must-See Musical,https://variety.com/2024/film/reviews/wicked-review-cynthia-erivo-ariana-grande-1236214272/,"... 'wicked' review: cynthia erivo ariana grande give ... best movie scenes 2024: 'dune 2' sandworms, 'wicked' ozdust ballroom more.",2024-11-19,0.75,Positive
Wicked 2024 reviews,General Reviews,FlixChatter Review: WICKED Part I (2024) – Cynthia Erivo & Ariana ...,https://flixchatter.net/2024/11/21/flixchatter-review-wicked-part-i-2024-cynthia-erivo-ariana-grande-are-wicked-good-in-jon-m-chus-vivid-dazzling-and-surprisingly-heartfelt-movie-musical/,"... cynthia erivo & ariana grande wicked good jon m. chu's vivid, dazzling, surprisingly heartfelt movie musical",2024-11-21,0.315,Positive
Wicked 2024 reviews,General Reviews,Wicked: Part One (2024) - Ruthless Reviews,https://www.ruthlessreviews.com/movies/wicked-part-one-2024/,... wicked: part one (2024) · discovery witches. i'm big fan origin stories featuring villains. · cleverness story ...,2024-11-21,0.0,Neutral
Wicked 2024 reviews,General Reviews,Wicked: Part One (2024) - Movie Review - Parade,https://parade.com/movies/wicked-part-one-review,"... wicked stunning piece filmmaking go history alongside likes chicago, west side story original wizard oz.",2024-11-22,0.4375,Positive
Wicked 2024 reviews,General Reviews,'Wicked' Review: Long-Awaited Adaptation Defies Expectations,https://rendyreviews.com/movie-reviews/wicked-review,"... production standpoint, wicked excellent example musical adaptation done. despite unfamiliar ...",2024-11-22,0.5,Positive
Wicked 2024 reviews,General Reviews,Wicked: Part I (2024) review - The Official Steve Pulaski Website,https://www.stevepulaski.com/2024/11/27/wicked-part-i-2024-review/,... wicked: part (2024) review. dir. jon m. chu. by: steve pulaski. rating. surreal see film adaptation wicked hit theaters.,2024-11-27,0.25,Positive
Wicked 2024 reviews,General Reviews,It's not easy being green – Film Review: Wicked Part One – The ...,https://thequeerreview.com/2024/11/19/film-review-wicked-part-one/,"... cynthia erivo elphaba ariana granda glinda wicked, directed jon m. chu. courtesy universal pictures. enduring ...",2024-11-19,0.0,Neutral
Wicked 2024 reviews,General Reviews,Movie Review: Wicked (2024) – Norbert Haupt,https://norberthaupt.com/2024/11/30/movie-review-wicked-2024/,... 2 thoughts “movie review: wicked (2024)”. chelsea davis. unknown. dad! terrible movie ...,2024-11-30,-0.5625,Negative
Wicked 2024 reviews,General Reviews,Why 'Wicked' the movie is better than the Broadway musical - DC ...,https://dctheaterarts.org/2024/11/25/why-wicked-the-movie-is-better-than-the-broadway-musical/,"... home reviews 'wicked' movie better broadway musical ... november 25, 2024. share. facebook · twitter · pinterest · linkedin.",2024-11-25,0.25,Positive
Wicked 2024 reviews,General Reviews,Wicked Review: Gravity is No Match for Erivo & Grande's Soaring ...,https://popculturereviews.com/2024/11/19/wicked-review/,"... wicked would become musical movie, starring thee incredible cynthia erivo elphaba pop singer superstar ariana grande glinda.",2024-11-19,0.45,Positive
Wicked 2024 reviews,General Reviews,Wicked (2024) Spoiler Thread - Review That Movie! (Spoilers ...,https://forums.boxofficetheory.com/topic/32820-wicked-2024-spoiler-thread/,... rare adaptation long-running broadway smash hit that's better stage play based on.,2024-11-18,0.4,Positive
Wicked 2024 reviews,General Reviews,REVIEW: Wicked (2024) Dir. Jon M. Chu // BOSTON HASSLE,https://bostonhassle.com/review-wicked-2024-dir-jon-m-chu/," film, film review. review: wicked (2024) dir. jon m. chu. scandalacious, ozmopolitan, totally swankified! karenna umscheid.",2024-11-20,0.0,Neutral
Wicked 2024 reviews,General Reviews,Wicked review – Cynthia Erivo and Ariana Grande make the magic ...,https://www.theguardian.com/film/2024/nov/24/wicked-the-film-review-cynthia-erivo-and-ariana-grande-jon-m-chu-part-one-1,"... timely themes bullying, corrupt leaders demonisation difference, movie promises froth pink ...",2024-11-24,-0.3,Negative
Wicked 2024 reviews,General Reviews,REVIEW: “Wicked” (2024) |,https://keithandthemovies.com/2024/12/14/review-wicked-2024/,... uneven unwieldy production packs early laughs never soars either musical fantasy epic. mostly due ...,2024-12-14,-0.025,Negative
Wicked 2024 reviews,General Reviews,'Wicked' Review: A Spectacular Cinematic Triumph,https://www.forbes.com/sites/erikkain/2024/11/25/wicked-review-a-spectacular-cinematic-triumph/,"... i'm pleased report movie captures magic musical almost perfectly, adding magic along way. often ...",2024-11-25,0.5,Positive
Is Wicked a good movie?,General Reviews,WICKED. Was the movie any good? : r/wicked,https://www.reddit.com/r/wicked/comments/1gx1k96/wicked_was_the_movie_any_good/,"... ariana glinda best thing could happen movie. comedic timing, vocals, acting sweet cotton candy.",2024-11-22,0.45,Positive
Is Wicked a good movie?,General Reviews,An Honest Review of the 'Wicked' Movie,https://k923.fm/wicked-review/,"... 'wicked: part one' released theaters nationwide friday, november 22. movie currently 89% rating rotten tomatoes 98 ...",2024-11-22,0.0,Neutral
Is Wicked a good movie?,General Reviews,Is the New 'Wicked' Movie Actually That Good?,https://wobm.com/wicked-movie-review/,"... two half hours long, wicked movie almost long wicked play, even though former adapts first half ...",2024-11-23,-0.030555555555555555,Negative
Is Wicked a good movie?,General Reviews,Why 'Wicked' the movie is better than the Broadway musical - DC ...,https://dctheaterarts.org/2024/11/25/why-wicked-the-movie-is-better-than-the-broadway-musical/,"... chu's wicked deeply compelling story also brings message could exactly kind good world needs. laugh, ...",2024-11-25,0.475,Positive
Is Wicked a good movie?,General Reviews,'Wicked' Is Finally Here—These Are My Thoughts | The Everygirl,https://theeverygirl.com/wicked-movie-review/,"... like book musical, little something everyone wicked movie. ... wicked witch west glinda good ...",2024-11-22,0.1708333333333333,Positive
Is Wicked a good movie?,General Reviews,"Review: For a Movie About Defying Gravity, Wicked Is Leaden | TIME",https://time.com/7177832/wicked-movie-review/,"... meanwhile, big message wicked—no one good bad—blinks assaultively sure means.",2024-11-20,0.39999999999999997,Positive
Is Wicked a good movie?,General Reviews,'Wicked' Review: Cynthia Erivo and Ariana Grande in Oz - The New ...,https://www.nytimes.com/2024/11/21/movies/wicked-review.html,"... despite bumps, movie consistently amusing simply “the wizard oz” fun watching colorful, off-kilter ...",2024-11-27,0.3,Positive
Is Wicked a good movie?,General Reviews,'Wicked' Reviewed By 9 and 7 Year Old Superfans of the Show,https://screencrush.com/kids-review-wicked-movie/,"... good “defying gravity.” also liked how, broadway … felt real movie broadway ...",2024-11-22,0.49999999999999994,Positive
Is Wicked a good movie?,General Reviews,Wicked Movie Review from a Former Musical Theatre Kid,https://thekit.ca/culture/wicked-movie-review-ariana-grande/,"... film elevates world oz dazzling aesthetic heights. celebrates strengths leads, erivo grande, hunky jonathan bailey.",2024-11-25,0.75,Positive
Is Wicked a good movie?,General Reviews,Wicked Movie Review for Parents - Music City Moms,https://musiccitymoms.net/arts-a-entertainment/wicked-movie-review-for-parents/,... general feel movie rated pg reason. parents consider content script well displays ...,2024-11-19,0.05000000000000002,Positive
Is Wicked a good movie?,General Reviews,Joyce Kulhawik - WICKED is wicked good. JoycesChoices Reviews ...,https://m.facebook.com/joyce.kulhawik/photos/wicked-is-wicked-good-joyceschoices-reviews-httpsjoyceschoicescommovie-wicked/948193967127570/,"... ... 󰤥 13. 󰤦 2. 󰤧. amy j. putnam. glad loved movie! did, too. one nitpick review. say: 'the role elphaba's ...",2024-11-25,0.6875,Positive
Is Wicked a good movie?,General Reviews,Review: 'Wicked' Is As Enchanting As It Is Exhausting,https://www.vulture.com/article/review-wicked-is-as-enchanting-as-it-is-exhausting.html,"... chu's latest, wicked, pretty good, too, though one misses sheer attack previous work. massive (some might say swollen) spectacle ...",2024-11-19,0.21388888888888888,Positive
